{
  "$schema": "https://json-schema.org/draft/2020-12/schema",
  "$id": "https://raw.githubusercontent.com/nccrypto/agentic-commerce-toolkit/main/schemas/acp-evidence-request-v1.schema.json",
  "title": "Virtuals ACP Public Evidence Verification Request v1",
  "description": "A bounded public-only request envelope for local or ACP-delivered verification of a source manifest and agent-job result.",
  "type": "object",
  "additionalProperties": false,
  "required": [
    "schemaVersion",
    "requestId",
    "jobType",
    "mode",
    "sourceManifest",
    "jobResult"
  ],
  "properties": {
    "schemaVersion": {"const": "1.0"},
    "requestId": {
      "type": "string",
      "pattern": "^[a-z0-9][a-z0-9._:-]{2,99}$"
    },
    "jobType": {"const": "virtuals-acp.public-evidence-verification"},
    "mode": {"enum": ["local", "virtuals-acp"]},
    "sourceManifest": {
      "type": "object",
      "minProperties": 1,
      "maxProperties": 20,
      "description": "Candidate source-manifest-v1 document. The provider reports contract findings instead of rejecting a nonconforming candidate at transport validation."
    },
    "jobResult": {
      "type": "object",
      "minProperties": 1,
      "maxProperties": 30,
      "description": "Candidate agent-job-result-v1 document. The provider reports contract findings instead of rejecting a nonconforming candidate at transport validation."
    }
  }
}
