{
  "schemaVersion": "1.0",
  "requestId": "example:public-evidence:2026-07-15",
  "jobType": "virtuals-acp.public-evidence-verification",
  "mode": "local",
  "sourceManifest": {
    "schemaVersion": "1.0",
    "manifestId": "example:reppo-public-api:2026-07-11",
    "generatedAt": "2026-07-11T00:00:00Z",
    "subject": {
      "kind": "protocol-source",
      "name": "Reppo public API inspector inputs",
      "version": "v0.1.0",
      "description": "Synthetic example manifest for public sources used by the read-only Reppo inspector."
    },
    "sources": [
      {
        "sourceId": "reppo-docs-api-reference",
        "title": "Reppo API reference",
        "url": "https://docs.reppo.xyz/",
        "sourceType": "documentation",
        "publisher": "Reppo",
        "accessedAt": "2026-07-11T00:00:00Z",
        "usage": {
          "purpose": "schema-reference",
          "derivedFacts": [
            "The inspector should use public Reppo endpoints only.",
            "Source URLs and fetch timing belong in the machine-readable output envelope."
          ],
          "limitations": [
            "Documentation can drift from live API behavior, so compatibility checks should record partial failures instead of fabricating replacement data."
          ]
        }
      },
      {
        "sourceId": "reppo-public-datanets-endpoint",
        "title": "Reppo public datanet catalog endpoint",
        "url": "https://api.reppo.xyz/public/subnets",
        "sourceType": "api",
        "publisher": "Reppo",
        "accessedAt": "2026-07-11T00:00:00Z",
        "usage": {
          "purpose": "input",
          "derivedFacts": [
            "Datanet catalog responses are preserved under the inspector envelope data field.",
            "The endpoint is queried read-only and does not require authentication."
          ],
          "limitations": [
            "Availability and response shape can change upstream."
          ]
        }
      }
    ],
    "notes": [
      "This example is synthetic and contains no credentials, private account data, or local runtime state."
    ]
  },
  "jobResult": {
    "schemaVersion": "1.0",
    "jobId": "example:reppo-inspection:2026-07-14",
    "jobType": "reppo.public-inspection",
    "status": "partial",
    "startedAt": "2026-07-14T12:00:00Z",
    "completedAt": "2026-07-14T12:00:02Z",
    "request": {
      "summary": "Inspect bounded public Reppo catalog endpoints using a synthetic request summary.",
      "inputs": [
        {
          "name": "catalogs",
          "value": [
            "datanets",
            "pods",
            "stats"
          ]
        },
        {
          "name": "limit",
          "value": 10
        }
      ]
    },
    "result": {
      "summary": "The public datanet and pod catalogs returned data; the documented stats route was unavailable.",
      "data": {
        "catalogs": {
          "datanets": {
            "available": true,
            "itemsReturned": 2
          },
          "pods": {
            "available": true,
            "itemsReturned": 2
          },
          "stats": {
            "available": false,
            "httpStatus": 404
          }
        }
      }
    },
    "provenance": {
      "manifestId": "example:reppo-public-api:2026-07-11",
      "manifestUrl": "https://raw.githubusercontent.com/nccrypto/agentic-commerce-toolkit/main/examples/source-manifest/reppo-public-api-manifest-v1.example.json",
      "sourceIds": [
        "reppo-docs-api-reference",
        "reppo-public-datanets-endpoint"
      ]
    },
    "cost": {
      "amount": "0",
      "currency": "USD",
      "basis": "measured"
    },
    "timeout": {
      "limitMs": 5000,
      "elapsedMs": 2000,
      "timedOut": false
    },
    "freshness": {
      "evaluatedAt": "2026-07-14T12:00:02Z",
      "status": "stale",
      "dataAsOf": "2026-07-11T00:00:00Z",
      "maxAgeSeconds": 86400
    },
    "errors": [
      {
        "code": "HTTP_ERROR",
        "message": "The documented public stats route returned HTTP 404.",
        "retryable": true
      }
    ],
    "limitations": [
      "This synthetic example does not represent a live compatibility check.",
      "The provenance reference identifies public evidence but does not prove that an upstream source is still available."
    ]
  }
}
